{
  "slug": "comfyui",
  "name": "ComfyUI",
  "homepage": "https://github.com/Comfy-Org/ComfyUI",
  "repo": "Comfy-Org/ComfyUI",
  "license": "GPL-3.0",
  "selfHostable": true,
  "hosted": {
    "exists": false
  },
  "deploy": [],
  "stack": [],
  "categories": [
    "ai-image"
  ],
  "stats": {
    "stars": 139088,
    "lastCommit": "2026-10-18",
    "createdAt": "2023-01-17",
    "archived": false,
    "checkedOn": "2026-10-19"
  },
  "markets": [
    "en"
  ]
}
