{
  "slug": "mprocs",
  "name": "mprocs",
  "homepage": "https://github.com/pvolok/dekit",
  "repo": "pvolok/dekit",
  "license": "MIT",
  "selfHostable": true,
  "hosted": {
    "exists": false
  },
  "deploy": [],
  "stack": [],
  "categories": [
    "dev-tools"
  ],
  "stats": {
    "stars": 2758,
    "lastCommit": "2026-10-15",
    "createdAt": "2021-08-30",
    "archived": false,
    "checkedOn": "2026-10-18"
  },
  "markets": [
    "en"
  ]
}
