{
  "slug": "whisper-cpp",
  "name": "whisper.cpp",
  "homepage": "https://github.com/ggml-org/whisper.cpp",
  "repo": "ggml-org/whisper.cpp",
  "license": "MIT",
  "selfHostable": true,
  "hosted": {
    "exists": false
  },
  "deploy": [],
  "stack": [],
  "categories": [
    "audio-video",
    "meeting-notes",
    "ai-audio",
    "video-meetings",
    "voice-dictation"
  ],
  "stats": {
    "stars": 54481,
    "lastCommit": "2026-10-12",
    "createdAt": "2022-09-25",
    "archived": false,
    "checkedOn": "2026-10-19"
  },
  "markets": [
    "en"
  ]
}
