{
  "slug": "vega-lite",
  "name": "Vega-Lite",
  "homepage": "https://github.com/vega/vega-lite",
  "repo": "vega/vega-lite",
  "license": "BSD-3-Clause",
  "selfHostable": true,
  "hosted": {
    "exists": false
  },
  "deploy": [],
  "stack": [],
  "categories": [
    "design"
  ],
  "stats": {
    "stars": 5524,
    "lastCommit": "2026-10-08",
    "createdAt": "2014-11-20",
    "archived": false,
    "checkedOn": "2026-10-18"
  },
  "markets": [
    "en"
  ]
}
