{
  "slug": "obs-studio",
  "name": "OBS Studio",
  "homepage": "https://github.com/obsproject/obs-studio",
  "repo": "obsproject/obs-studio",
  "license": "GPL-2.0",
  "selfHostable": true,
  "hosted": {
    "exists": false
  },
  "deploy": [],
  "stack": [],
  "categories": [
    "screen-recording"
  ],
  "stats": {
    "stars": 77709,
    "lastCommit": "2026-10-16",
    "createdAt": "2013-10-01",
    "archived": false,
    "checkedOn": "2026-10-18"
  },
  "markets": [
    "en"
  ]
}
