{
  "slug": "rrweb",
  "name": "rrweb",
  "homepage": "https://github.com/rrweb-io/rrweb",
  "repo": "rrweb-io/rrweb",
  "license": "MIT",
  "selfHostable": true,
  "hosted": {
    "exists": false
  },
  "deploy": [],
  "stack": [],
  "categories": [
    "monitoring"
  ],
  "stats": {
    "stars": 20277,
    "lastCommit": "2026-10-15",
    "createdAt": "2018-10-06",
    "archived": false,
    "checkedOn": "2026-10-18"
  },
  "markets": [
    "en"
  ]
}
